{"artifact_inventory_hash":"65940fa91912e21bd8111a8fa4a5e6eeb77e7dac88cc32baa701b24a24ac2f14","benchmark_control_status":"PASS","failures":["WO11-F-B003-EZ-GP-DIRECT-v1-rank_1_fraction","WO11-F-B003-EZ-GP-DIRECT-v1-top_k_fraction","WO11-F-B003-EZ-SEMF-GP-RESIDUAL-v1-rank_1_fraction","WO11-F-B003-EZ-SEMF-LS-v1-calibration_error_90","WO11-F-B003-EZ-SEMF-LS-v1-rank_1_fraction","WO11-F-B003-EZ-SEMF-LS-v1-sign_fraction","WO11-F-B003-EZ-SEMF-LS-v1-top_k_fraction","WO11-F-B002-EZ-SEMF-LS-v1-undercoverage","WO11-F-B002-EZ-GP-DIRECT-v1-bias","WO11-F-B002-EZ-GP-DIRECT-v1-overcoverage","WO11-F-B002-EZ-SEMF-GP-RESIDUAL-v1-overcoverage"],"input_release":"elementzero-validation-ladder-v0.3","model_readiness_verdict":"FRONTIER_MODEL_RERUN_JUSTIFIED","replay_status":"PASS","wo12_prerequisites":["Define EZ-B002-v2 and EZ-B003-v2 as new preregistered protocol versions; the v1 results stay frozen and are never relabeled or rerun.","Keep EZ-SEMF-LS-v1, EZ-GP-DIRECT-v1, and EZ-SEMF-GP-RESIDUAL-v1 in every WO-12 run as controls; do not replace them.","Integrate at least one physics-rich global mass model (Class A: BSkG4 or BSkG5 published tables) as the physics backbone.","Add a second, scientifically independent global model family and a Bayesian/ensemble combination layer (Class B) so model-family disagreement becomes measurable.","Add residual/ML models (Class C) in challenger roles only; no ML model may be the sole source of truth.","Include the optimizer-enabled GP configuration from the WO-11 dev grid as a configuration control: the dev evidence shows the frozen fixed-kernel configuration understates the baseline family.","Repair predictive-uncertainty calibration before v2 scoring: v1 GP sigmas are orders of magnitude too wide (std(z) near 0) and the SEMF-LS global sigma cannot absorb structured bias (mean(z) near -1.6).","Freeze v2 thresholds on synthetic mechanics before any evaluated-table truth is read, exactly as B003 v1 did.","Pin the runtime environment (interpreter minor version and library versions) in the v2 protocol so strict byte replay stays achievable.","Complete license and availability review for every candidate before integration; a candidate without traceable publications and data/code stays out of WO-12.","Never tune any frontier candidate on EZ-B002/EZ-B003 hidden truth; public training data only, verified through the existing leakage firewalls."],"work_order":"WO-11"}
